{
  "$schema": "../schema/gantt-exchange.schema.json",
  "format": "gantt-exchange",
  "schemaVersion": "1.0",
  "meta": {
    "source": "demo:gantt",
    "sourceName": "Демо-данные",
    "exportedAt": "2026-09-26T11:20:00+07:00",
    "kind": "changes",
    "exportedBy": "Руководитель проекта"
  },
  "changes": [
    {
      "changeId": "d341826a-ba76-5cc6-aa48-2ee57a29eb20",
      "nodeId": "2710da69-3119-531c-934b-4fba08e7cf7a",
      "field": "planEnd",
      "oldValue": "2026-04-13",
      "newValue": "2026-04-27",
      "baseVersion": null,
      "author": "Руководитель проекта",
      "machine": "IT-PC-07",
      "at": "2026-09-26T11:18:40+07:00",
      "comment": "Перенос по согласованию с отделом"
    },
    {
      "changeId": "5f0101fd-12a6-5297-a3d9-f18ce5251f30",
      "nodeId": "990e7c01-a874-5424-a8c9-45ce763752a0",
      "field": "status",
      "oldValue": "inProgress",
      "newValue": "done",
      "baseVersion": null,
      "author": "Руководитель проекта",
      "machine": "IT-PC-07",
      "at": "2026-09-26T11:19:05+07:00",
      "comment": null
    },
    {
      "changeId": "bb7684d9-884f-5ab9-a09e-848f2723d3f0",
      "nodeId": "990e7c01-a874-5424-a8c9-45ce763752a0",
      "field": "factEnd",
      "oldValue": null,
      "newValue": "2026-09-26",
      "baseVersion": null,
      "author": "Руководитель проекта",
      "machine": "IT-PC-07",
      "at": "2026-09-26T11:19:05+07:00",
      "comment": null
    }
  ]
}
